,0
0,Annie Chuns Soup Bowl - Vietnamese Pho
1,Maruchan Noodles - Yakisoba Japanese Home-Style
2,Maruchan Ramen Noodle - Beef Flavor
3,Maruchan Ramen Noodle - Chicken Flavor
4,Maruchan Ramen Noodle Soup - Souper 6-Pack Oriental Fla...
5,Maruchan Ramen Noodle Soup Souper Roast Chicken Flavor
6,Maruchan Soup - Ramen Noodle Souper 6 Pack Chicken Flav...
7,Maruchan Soup - Ramen Noodle Souper 6-Pack Beef Flavor
8,Maruchan Yakisoba - Cheddar Cheese Flavor
9,Maruchan Yakisoba - Teriyaki Beef Flavor
10,Maruchan Yakisoba Spicy Chicken Flavor
11,Maruchan Bowl Chicken Flavor Bowl
12,Maruchan Bowl Hot & Spicy Chicken Bowl
13,Maruchan Bowl Hot & Spicy Shrimp Bowl
14,Nissin Bowl Noodles Hot & Spicy Beef Ramen Noodle Sou...
15,Nissin Top Ramen Soup - Oriental
16,Nissin Cup Noodles Cup Noodles - With Shrimp
17,Nissin Cup Noodles Cup Noodles Beef Flavor Ramen Noodle Soup
18,Nissin Top Ramen Top Ramen - Beef Flavor
19,Nissin Top Ramen Top Ramen Chicken Flavor Ramen Noodle Soup
20,Nissin Top Ramen Top Ramen Chicken Flavor Ramen Noodle Soup
21,Nong Shim Kimchi Noodle Soup Bowl
22,"One Culture Foods Japanese Spicy Ramen, Chicken Flavor"
23,One Culture Foods Vietnamese Beef Pho
24,San - J White Miso With Tofu & Scallions
25,Sun Bird Soup Mix - Hot & Sour
26,Sushi Chef Soup - Red Miso Traditional Japanese Style
27,Casa Mexicana Taco Seasoning
28,Huy Fong Sriracha Hot Chili Sauce
29,Kikkoman Seasoning Mix - Fried Rice
30,Kikkoman Stir-Fry Seasoning Mix
31,McCormick Gourmet Sriracha Seasoning
32,Mitsukan Mirin
33,S&B Wasabi - Prepared In Tube
34,Southern Tsunami Green Horseradish
35,Sun Bird Seasoning Mix - Fried Rice
36,Sun Bird Seasoning Mix - Stir-Fry
37,Sunbird Seasoning Mix - Beef & Broccoli
38,Asian Gourmet Duck Sauce
39,Asian Gourmet Hoisin Sauce
40,Blue Dragon General Tao Stir Fry Sauce
41,Crisco Grill Master - Professional No-Stick Grill Spr...
42,"Harris Teeter Sauce, Yum Yum"
43,Harris Teeter Soy Sauce
44,Harris Teeter Soy Sauce - Lite
45,House Of Tsang Bangkok Padang Peanut Sauce
46,House Of Tsang Classic Stir Fry Sauce
47,House Of Tsang General Tsao Sauce
48,House Of Tsang Stir Fry Sauce - Korean Teriyaki
49,House Of Tsang Szechuan Spicy Stir Fry Sauce
50,HT Traders Fiery Toasted Sesame Oil
51,HT Traders General Tso's Sauce
52,HT Traders Soy Sauce
53,HT Traders Soy Sauce - Lite
54,HT Traders Spicy Orange Sauce
55,HT Traders Spicy Pepper Stir-Fry Oil
56,HT Traders Sriracha Sauce
57,HT Traders Stir Fry Oil - Garlic
58,HT Traders Teryaki Sauce
59,Huy Fong Chili Garlic Sauce
60,Ka-Me Oyster Flavored Sauce
61,Kikkoman Gluten Free Soy Sauce
62,Kikkoman Hoisin Sauce
63,"Kikkoman Hoisin Sauce, Gluten-Free"
64,Kikkoman Organic Soy Sauce
65,Kikkoman Oyster Sauce
66,Kikkoman Ponzu
67,Kikkoman Soy Sauce
68,Kikkoman Soy Sauce
69,Kikkoman Soy Sauce
70,Kikkoman Soy Sauce
71,Kikkoman Soy Sauce
72,Kikkoman Soy Sauce - All-Purpose Seasoning Naturally Br...
73,Kikkoman Soy Sauce - All-Purpose Seasoning Naturally Br...
74,Kikkoman Soy Sauce - Less Sodium
75,Kikkoman Soy Sauce - Lite Sodium
76,Kikkoman Stir-Fry Sauce
77,Kikkoman Sweet & Sour Sauce
78,Lee Kum Kee Chili Garlic Sauce
79,Lee Kum Kee Hoisin Sauce
80,Lee Kum Kee Lettuce Wrap Sauce
81,Lee Kum Kee Panda Brand Oyster Flavored Sauce
82,Lee Tokyo Gourmet Japanese Sauce
83,MAGGI Sweet Chili Sauce - Mild
84,Mee Tu Duck Sauce
85,P.F. Chang's Teriyaki Sauce
86,"Passage Foods Stirfry Sauce, Mild, Pad Thai"
87,S&B Original Wasabi Sauce
88,Saffron Road Lemon Grass Basil Simmer Sauce
89,San J Gluten Free Lite Tamari Sauce
90,San-J Soy Sauce - Organic Tamari
91,San-J Soy Sauce - Organic Tamari - Wheat Free
92,San-J Tamari Soy Sauce
93,Sharwood's Thai Green Curry
94,Stonewall Kitchen Sesame Ginger Teriyaki Sauce
95,Sushi Chef Soy Sauce - Dark
96,Sushi Chef Traditional Japanese Style Mirin - Sweetened S...
97,Texas Pete Sriracha Sauce Cha
98,"Annie Chuns Soup Bowl, Coconut, Thai-Style, Medium"
99,Hapi Wasabi Peas - Hot
100,HT Traders Wasabi Peas
101,Pocky Biscuit Sticks Covered with Strawberry Cream
102,"Shirakiku Ramune Drink, Carbonated, Strawberry"
103,Sushi Chef Pickled Ginger
104,Thai Kitchen Aseptic Coconut Milk
105,Annie Chuns Maifun Brown Rice Noodles
106,Annie Chuns Noodle Soup - Miso with Tofu and Scallion
107,Asian Gourmet Chinese Noodles
108,Asian Gourmet Chinese Wide Lo Mein Noodles
109,Asian Gourmet Noodles - Extra Crispy
110,Blue Dragon Medium Egg Noodles
111,Blue Dragon Vietmanese Spring Roll Wrappers
112,Hakubaku Organic Ramen Noodles
113,KA ME Rice Sticks
114,KA ME Stir Fry Udon Noodles
115,Ka-Me Pad Thai Express Rice Noodles
116,Ka-Me Stir Fry Hokkien Noodles
117,Ka-Me Stir Fry Soba Noodles
118,Ka-Me Thai Rice Noodles - Stir Fry
119,La Choy Chow Mein Noodles
120,La Choy Rice Noodles
121,"Maruchan Ramen Noodle Soup, Gold, Spicy Miso Flavor"
122,Nasoya Shirataki Noodles
123,Nissin Premium Chicken Flavor Chow Mein Noodles
124,"Tasty Bite Rice, Organic, Smoky Chipotle"
125,"Tasty Bite Sticky Rice, Organic"
126,Thai Kitchen Brown Rice Stir-Fry Noodles
127,Ginger People Pantry Essentials Sushi Ginger - Natural Pickl...
128,"Goya Coco, Cream of Coconut"
129,HT Traders Bamboo Shoots
130,HT Traders Corn - Whole Baby
131,HT Traders Water Chestnuts - Diced
132,HT Traders Water Chestnuts - Sliced
133,Mrs. Camp Chow Chow - Hot
134,Sharwood's Curry Cooking
135,Wel Pac Fueru Wakame
